,record_id,user_id,role,education_level,subject_area,ai_tool,ai_use_purpose,ai_use_frequency_per_week,session_count,avg_session_duration_min,tasks_completed,hints_requested,text_feedback,sentiment_label,sentiment_polarity,subjectivity,emotion_primary,pre_test_score,post_test_score,improvement,adaptive_difficulty_start,adaptive_difficulty_end,recommended_resources_count,perceived_usefulness,perceived_ease_of_use,trust_score,adoption_intention,satisfaction_score,ethical_concern_privacy,ethical_concern_plagiarism,dropout_flag,timestamp
0,1,S439563,student,graduate,Physics,LLM Assistant,summarization,5,22,18,63,4,"I evaluated the LLM Assistant for summarization in Physics at the graduate level; it reduced my effort on key goals significantly.Feeling anxiety, it sometimes confused me and I remain cautious about fairness and transparency. This shaped my attitude toward AI tools in learning/teaching in a negative way. (note 67a39d)",negative,-0.676,0.526,anxiety,66,67,1,1,4,8,2,3,3,2,2,3,5,0,2/8/2023 2:56
1,2,S229815,student,graduate,Sociology,Concept Mapper,brainstorming,3,27,8,85,8,"I evaluated the Concept Mapper for brainstorming in Sociology at the graduate level; it clarified key goals considerably. Feeling anticipation, the pace felt unchanged and I still think about privacy and academic integrity. In practice, this changed how I adapt my study plan and assessments. (note 610923)",neutral,-0.09,0.311,anticipation,60,78,18,2,1,5,1,4,3,2,4,2,4,0,5/17/2023 9:53
2,3,S698951,student,undergraduate,Chemistry,AI Tutor,note organization,0,21,10,82,15,"I adopted the AI Tutor for note organization in Chemistry at the undergraduate level; it gave me better feedback about key goals moderately. Feeling neutral, results were mixed and I prefer clearer guidance on ethical use. In practice, this changed how I adapt my study plan and assessments. (note bf97a2)",neutral,0.024,0.448,neutral,61,72,11,2,3,4,2,2,3,5,3,3,5,0,11/18/2023 15:53
3,4,S414834,student,undergraduate,Law,Quiz Generator,language translation,3,26,19,53,6,"I evaluated the Quiz Generator for language translation in Law at the undergraduate level; it helped me grasp key goals considerably.  Feeling joy, I felt more motivated and I cross-checked outputs to avoid plagiarism. This shaped my attitude toward AI tools in learning/teaching in a positive way. (note f178f1)",positive,0.289,0.609,joy,45,60,15,2,4,5,2,4,5,4,3,2,2,0,6/5/2023 16:41
4,5,S708064,student,undergraduate,Computer Science,AI Tutor,concept explanation,2,17,26,50,8,"I evaluated the AI Tutor for concept explanation in Computer Science at the undergraduate level; it sped up my study of key goals slightly.Feeling joy, I finished tasks faster than usual and I followed our policy on responsible AI use. In practice, this changed how I adapt my study plan and assessments. (note 23e7ad)",positive,0.246,0.751,joy,86,100,14,2,3,9,4,2,4,5,4,2,3,0,4/1/2024 9:42
